{ "id": "crypt_hall", "name": "Crypt Hall", "map": "crypt_hall", "level": 5, "party": { "min": 4, "max": 6 },
  "enemies": [ { "unit": "necromancer", "zone": "dais", "count": 1 },
               { "unit": "wraith", "zone": "dais", "count": 1 },
               { "unit": "skeleton_archer", "zone": "dais", "count": 2, "level": 5 },
               { "unit": "skeleton", "zone": "nave", "count": 4, "level": 5 },
               { "unit": "zombie", "zone": "alcove", "count": 2, "level": 5 } ],
  "xp": 800, "loot": ["crypt_vault"],
  "objectives": { "win": "defeat_all" } }
